{
  "protocol_format": "gordian-experiment-protocol-v1",
  "experiment_id": "snapshot-vs-rebase",
  "class": "agent-trial",
  "issue": 53,
  "hypothesis": {
    "h0": "Holding a stable exact base until candidate handoff (S) does not lower wall-clock time to Mission satisfaction against periodic rebasing onto the moving accepted frontier (R).",
    "h1": "S lowers median wall-clock time to Mission satisfaction by at least 15% relative to R in every stratification cell."
  },
  "falsification": "Snapshot isolation is retained as an architectural invariant only if S lowers median wall-clock to Mission satisfaction by at least 15% relative to R in every one of the four cells, with the 95% BCa interval on the paired Hodges-Lehmann shift excluding zero in the pooled analysis. If the threshold holds in some cells only, snapshot isolation is demoted from an invariant to a scheduler policy conditioned on those cells. If it holds in no cell, R is adopted and the stable-exact-base requirement is removed. S worse than R in any cell is filed as a defect before any adoption decision.",
  "conditions": [
    {
      "id": "S",
      "description": "stable exact base until candidate handoff"
    },
    {
      "id": "R",
      "description": "periodically rebase the worker onto the moving accepted frontier"
    }
  ],
  "baseline_condition": "R",
  "population": {
    "workloads": [
      "30 repository-level Missions per stratification cell"
    ],
    "sampling": "paired on the workload item within each cell; conditions in randomized order",
    "strata": [
      {
        "id": "duration.short",
        "boundary": "median Atom attempt wall-clock <= 20 minutes"
      },
      {
        "id": "duration.long",
        "boundary": "median Atom attempt wall-clock > 20 minutes"
      },
      {
        "id": "churn.quiet",
        "boundary": "<= 2 frontier admissions per hour on the base frontier"
      },
      {
        "id": "churn.busy",
        "boundary": "> 2 frontier admissions per hour on the base frontier"
      }
    ],
    "seeds": [
      1,
      2,
      3,
      4,
      5
    ]
  },
  "metrics": [
    {
      "id": "wall_clock_to_satisfaction",
      "unit": "seconds",
      "direction": "lower_is_better"
    },
    {
      "id": "reasoning_invalidations",
      "unit": "count",
      "direction": "lower_is_better"
    },
    {
      "id": "integration_conflicts",
      "unit": "count",
      "direction": "lower_is_better"
    },
    {
      "id": "work_discarded",
      "unit": "changed_lines",
      "direction": "lower_is_better"
    },
    {
      "id": "candidate_quality",
      "unit": "proportion_passing",
      "direction": "higher_is_better"
    },
    {
      "id": "model_tool_cost",
      "unit": "usd",
      "direction": "lower_is_better"
    }
  ],
  "analysis_plan": {
    "primary_metric": "wall_clock_to_satisfaction",
    "effect_size": {
      "measure": "paired Hodges-Lehmann shift, expressed as a relative reduction versus R",
      "minimum_relevant": 0.15,
      "unit": "relative reduction, required in every one of the four cells"
    },
    "min_n": 150,
    "multiplicity": "holm",
    "uncertainty": "BCa bootstrap 95% CI, 10000 resamples, resampling seed recorded",
    "stopping_rule": "fixed_n"
  },
  "exclusion_rule": "A trial is excluded when the harness crashes before the first dispatch, when the model endpoint returns a transport error on more than 10% of the calls in that trial, or when the workload item's fixture repository fails its own pre-flight test. Excluded trials are retained with their reason and counted in the report. The rule is applied by script before the primary metric is inspected and never by judgement.",
  "environment": {
    "source_commit": "pinned at run time; the exact commit is recorded in each run.json",
    "toolchains": [
      "rust 1.98.0 (rust-toolchain.toml)",
      "jujutsu version recorded per run",
      "tokei 12.1.2"
    ],
    "hardware_class": "reference-linux-x86_64"
  },
  "artifacts": [
    "runs/<run-id>/raw/transcript.jsonl",
    "runs/<run-id>/raw/frontier-events.jsonl"
  ],
  "threats": [
    "cell assignment computed after the run; the duration and churn bins are fixed in this protocol and assigned from the fixture, not from the outcome",
    "frontier churn generated by the harness rather than by real concurrent work"
  ],
  "registered_at": "2026-08-30T00:00:00Z",
  "registered_by": "gordian-spec-alignment"
}
